[
  {
    "field_id": "F0001",
    "issued_on": "2026-10-20",
    "p10": "2026-10-25",
    "p50": "2026-10-25",
    "p90": "2026-10-25",
    "source": "confirmed",
    "confidence": 1.0,
    "synthetic": true
  },
  {
    "field_id": "F0002",
    "issued_on": "2026-10-20",
    "p10": "2026-10-20",
    "p50": "2026-10-22",
    "p90": "2026-10-24",
    "source": "satellite",
    "confidence": 0.77,
    "synthetic": true
  },
  {
    "field_id": "F0003",
    "issued_on": "2026-10-20",
    "p10": "2026-10-18",
    "p50": "2026-10-20",
    "p90": "2026-10-23",
    "source": "satellite",
    "confidence": 0.65,
    "synthetic": true
  },
  {
    "field_id": "F0004",
    "issued_on": "2026-10-20",
    "p10": "2026-10-26",
    "p50": "2026-10-28",
    "p90": "2026-10-29",
    "source": "satellite",
    "confidence": 0.8,
    "synthetic": true
  },
  {
    "field_id": "F0005",
    "issued_on": "2026-10-20",
    "p10": "2026-10-20",
    "p50": "2026-10-21",
    "p90": "2026-10-22",
    "source": "satellite",
    "confidence": 0.74,
    "synthetic": true
  },
  {
    "field_id": "F0006",
    "issued_on": "2026-10-20",
    "p10": "2026-10-16",
    "p50": "2026-10-19",
    "p90": "2026-10-21",
    "source": "satellite",
    "confidence": 0.53,
    "synthetic": true
  }
]
